이미지,생활지수,지수,안내멘트,그래프 값,그래프 최댓값
../img/icon_idx_carwash.png?ver=20231226,세차지수,70,비 올 확률이 낮아 세차해도 되겠어요,70,100
../img/icon_idx_running.png?ver=20231226,달리기지수,77.5,달리고 싶다면 오늘 뛰어보세요,77.5,100
../img/icon_idx_washing.png?ver=20231226,빨래지수,64,오늘은 창을 열고 빨래를 널어보세요,64,100
../img/icon_idx_sleep.png?ver=20231226,수면지수,10,실내 온도와 습도 꼭 체크하세요!,10,100
../img/icon_idx_umb.png?ver=20231226,우산지수,10,비 소식 없으니 우산 없이 외출하세요,10,100
../img/icon_life_uv.png?ver=20231226,자외선지수,1,야외활동 안심하고 마음껏 하세요,25,100
../img/icon_life_cold.png?ver=20231226,감기지수,4,면역력 강화에 신경 써주세요,100,100
../img/icon_life_freez.png?ver=20231226,동파지수,25,동파지수가 매우 낮아요,25,100
